{
  "$schema": "../template.schema.json",
  "name": "react-ssr",
  "title": "React (server-rendered)",
  "description": "A React Router v7 app rendered on the server: a list page with a loader, a detail page, and a form with an action. It answers at the App's own hostname.",
  "tags": ["react", "react-router", "ssr", "vite", "frontend", "typescript"],
  "ref": "react-ssr",
  "env": [],
  "providers": [],
  "bundle_budget_bytes": 393216,
  "post_deploy": "Your app is live at {{url}}\n\nOpen it and read the page source: the list is already in the HTML.\nIt answers at the App's own hostname only, not under a preview URL.\n\nThen:\n  1. Work on it locally:\n       npm run dev\n  2. Open app/routes/home.tsx. The loader reads the list, and the action handles the form.\n  3. Follow the logs as requests arrive:\n       wawesome logs --follow"
}
