{
  "$schema": "../template.schema.json",
  "name": "scheduled-job",
  "title": "Scheduled Job",
  "description": "A scheduled background job that runs on a recurring timer — private visibility, a Schedule block, trigger verification, and structured logging.",
  "tags": ["scheduled", "cron", "timer", "background", "job", "typescript"],
  "ref": "scheduled-job",
  "env": [
    {
      "key": "TARGET_URL",
      "required": true,
      "secret": false,
      "opens_host": true,
      "description": "The https:// address the job checks on each run, e.g. https://httpbin.org/status/200 to try it out. Setting it opens that one host to your App's outbound calls. Left blank, every run fails and logs that it has nothing to check.",
      "where_to_find": "The health or status endpoint of the service you want to watch."
    },
    {
      "key": "JOB_SECRET",
      "required": false,
      "secret": true,
      "description": "Optional bearer token for manual HTTP requests when invoked outside of a scheduled run. A scheduled run skips this check automatically via the trigger header.",
      "where_to_find": "Any random secret string you generate, e.g. using `openssl rand -hex 24`."
    }
  ],
  "providers": [],
  "post_deploy": "Your scheduled job is deployed!\n\nThis Function is private and runs on a recurring Schedule.\n\nNext steps:\n  1. If you left TARGET_URL blank, set it. Its host is opened to your App as well:\n       wawesome env set TARGET_URL https://...\n  2. View your active schedules and next run times:\n       wawesome cron list\n  3. Follow execution logs in real time as scheduled runs fire:\n       wawesome logs --follow\n  4. Manually trigger a run without waiting for the next timer tick:\n       wawesome invoke\n  5. Pause or resume the schedule at any time:\n       wawesome cron pause health-check\n       wawesome cron resume health-check"
}
